{
  "tenant_id": "platform",
  "client_domain": "platform.local",
  "allowed_return_to": [
    "/admin",
    "/t/platform/console",
    "/t/platform/console/animals"
  ],
  "oidc_client_id": "flask-bff",
  "oidc_client_secret_env": "OIDC_CLIENT_SECRET",
  "console_modules": {
    "animals": true,
    "visualizations": true
  }
}
